{
  "meta": {
    "config_version": "balance-next-2026-08-24",
    "generated_at": "2026-08-24T00:00:00+08:00",
    "source_files": [
      "人格牌.xlsx",
      "pasted-text.txt"
    ],
    "source_sha256": "093bed388d8483ef7a3b04adb1367eaaef36788aed5b14ca13882b298e3b08d0",
    "priority_rule": "CURRENT_REQUEST_CONFIRMED > LATEST_EXCEL > LEGACY_EXCEL > WEB_PROTOTYPE > HISTORICAL_GDD",
    "schema_version": "https://json-schema.org/draft/2020-12/schema",
    "source_tables": [
      {
        "sheet": "全局配置",
        "header_row": 1,
        "fields": [
          "规则_ID",
          "规则名称",
          "数值类型",
          "配置数值"
        ],
        "record_count": 13,
        "source_role": "authoritative_with_overrides"
      },
      {
        "sheet": "关卡流程",
        "header_row": 1,
        "fields": [
          "阶段_ID",
          "关卡名称",
          "顺序",
          "关卡类型描述",
          "分数类型",
          "分数参数",
          "手牌限制",
          "弃牌限制",
          "AI节点",
          "人格牌生成数量",
          "奖励类型1",
          "奖励参数1",
          "奖励类型2",
          "奖励参数2"
        ],
        "record_count": 13,
        "source_role": "authoritative_with_overrides"
      },
      {
        "sheet": "牌型配置",
        "header_row": 1,
        "fields": [
          "手牌_ID",
          "牌型名称",
          "计分牌数",
          "牌型品质_ID",
          "基础筹码",
          "基础倍率",
          "显示顺序"
        ],
        "record_count": 11,
        "source_role": "supporting_or_unconfirmed"
      },
      {
        "sheet": "卡牌配置",
        "header_row": 1,
        "fields": [
          "卡牌_ID",
          "卡牌名称",
          "卡牌类型",
          "花色",
          "点数",
          "参数类型",
          "参数1"
        ],
        "record_count": 52,
        "source_role": "supporting_or_unconfirmed"
      },
      {
        "sheet": "人格牌配置",
        "header_row": 1,
        "fields": [
          "人格牌_ID",
          "人格牌名称",
          "词条_ID",
          "主属性_ID",
          "次级属性_ID",
          "最大属性数量",
          "最大次级属性数量",
          "次级属性池数量"
        ],
        "record_count": 8,
        "source_role": "authoritative_with_overrides"
      },
      {
        "sheet": "人格牌_词条",
        "header_row": 1,
        "fields": [
          "词条_ID",
          "触发条件描述",
          "条件类型",
          "比较符",
          "条件参数"
        ],
        "record_count": 8,
        "source_role": "authoritative_with_overrides"
      },
      {
        "sheet": "人格牌_主属性",
        "header_row": 1,
        "fields": [
          "主属性_ID",
          "属性类型",
          "属性参数1",
          "属性参数2",
          "开放节点"
        ],
        "record_count": 8,
        "source_role": "authoritative_with_overrides"
      },
      {
        "sheet": "人格牌_次级属性",
        "header_row": 1,
        "fields": [
          "次级属性_ID",
          "所属人格",
          "权重",
          "属性类型",
          "属性参数1",
          "属性参数2",
          "开放节点"
        ],
        "record_count": 40,
        "source_role": "authoritative_with_overrides"
      },
      {
        "sheet": "商品_商品",
        "header_row": 1,
        "fields": [
          "商品_ID",
          "商品名称",
          "商品类型",
          "价格",
          "购买次数限制",
          "效果类型",
          "效果参数1",
          "效果参数2"
        ],
        "record_count": 65,
        "source_role": "supporting_or_unconfirmed"
      },
      {
        "sheet": "商店_人格铸造",
        "header_row": 1,
        "fields": [
          "功能_ID",
          "功能名称",
          "价格"
        ],
        "record_count": 2,
        "source_role": "authoritative_with_overrides"
      },
      {
        "sheet": "商店_商品槽位刷新规则",
        "header_row": 1,
        "fields": [
          "刷新_ID",
          "商店刷新节点",
          "商品类型",
          "出现数量",
          "出现权重"
        ],
        "record_count": 9,
        "source_role": "supporting_or_unconfirmed"
      },
      {
        "sheet": "商店_商品刷新规则",
        "header_row": 1,
        "fields": [
          "商品池_ID",
          "商品_ID",
          "权重"
        ],
        "record_count": 65,
        "source_role": "supporting_or_unconfirmed"
      },
      {
        "sheet": "牌型品质定义表",
        "header_row": 1,
        "fields": [
          "牌型品质_ID",
          "品质名称",
          "品质等级"
        ],
        "record_count": 2,
        "source_role": "supporting_or_unconfirmed"
      },
      {
        "sheet": "比较符定义表",
        "header_row": 1,
        "fields": [
          "比较符_ID",
          "中文名称",
          "说明"
        ],
        "record_count": 8,
        "source_role": "supporting_or_unconfirmed"
      },
      {
        "sheet": "图片配置",
        "header_row": 1,
        "fields": [
          "图片_ID",
          "卡牌名称",
          "卡牌类型",
          "卡牌链接"
        ],
        "record_count": 103,
        "source_role": "supporting_or_unconfirmed"
      }
    ],
    "implementation_note": "规范化配置尚未自动覆盖网页运行时；NOT_IMPLEMENTED / CONFIG_READY_NOT_WIRED 字段必须保留。"
  },
  "global_rules": {
    "active_persona_slots": 4,
    "base_play_limit": 4,
    "base_discard_limit": 3,
    "base_persona_count": 8,
    "subtrait_slots_per_persona": 3,
    "initial_unlocked_subtrait_slots": 1,
    "ai_generated_personas": 3,
    "ai_carry_out_count": 1,
    "boss_gold": 0
  },
  "stages": [
    {
      "id": "STAGE_01",
      "name": "关卡1",
      "order": 1,
      "type": "BATTLE",
      "gold_eligible": true,
      "base_coin": 5,
      "target_score": 550,
      "score_rule_type": "通关分数",
      "play_limit": 4,
      "discard_limit": 3,
      "difficulty": "UNSPECIFIED",
      "ai_index": 0,
      "persona_generate_count": 0,
      "implementation_status": "CONFIG_READY_NOT_WIRED",
      "source": {
        "file": "人格牌.xlsx",
        "sheet": "关卡流程",
        "row": 2,
        "raw": {
          "type": "战斗",
          "reward_type": "金币",
          "reward_value": 5
        }
      }
    },
    {
      "id": "STAGE_02",
      "name": "关卡2",
      "order": 2,
      "type": "BATTLE",
      "gold_eligible": true,
      "base_coin": 5,
      "target_score": 625,
      "score_rule_type": "通关分数",
      "play_limit": 4,
      "discard_limit": 3,
      "difficulty": "UNSPECIFIED",
      "ai_index": 0,
      "persona_generate_count": 0,
      "implementation_status": "CONFIG_READY_NOT_WIRED",
      "source": {
        "file": "人格牌.xlsx",
        "sheet": "关卡流程",
        "row": 3,
        "raw": {
          "type": "战斗",
          "reward_type": "金币",
          "reward_value": 5
        }
      }
    },
    {
      "id": "STAGE_03",
      "name": "关卡3",
      "order": 3,
      "type": "BATTLE",
      "gold_eligible": true,
      "base_coin": 8,
      "target_score": 675,
      "score_rule_type": "通关分数",
      "play_limit": 4,
      "discard_limit": 3,
      "difficulty": "UNSPECIFIED",
      "ai_index": 0,
      "persona_generate_count": 0,
      "implementation_status": "CONFIG_READY_NOT_WIRED",
      "source": {
        "file": "人格牌.xlsx",
        "sheet": "关卡流程",
        "row": 4,
        "raw": {
          "type": "战斗",
          "reward_type": "金币",
          "reward_value": 8
        }
      }
    },
    {
      "id": "STAGE_04",
      "name": "AI1",
      "order": 4,
      "type": "SHOP",
      "gold_eligible": false,
      "base_coin": 0,
      "target_score": 0,
      "score_rule_type": "无",
      "play_limit": 0,
      "discard_limit": 0,
      "difficulty": "N/A",
      "ai_index": 1,
      "persona_generate_count": 1,
      "implementation_status": "CONFIG_READY_NOT_WIRED",
      "source": {
        "file": "人格牌.xlsx",
        "sheet": "关卡流程",
        "row": 5,
        "raw": {
          "type": "商店",
          "reward_type": "无",
          "reward_value": "无"
        }
      }
    },
    {
      "id": "STAGE_05",
      "name": "关卡4",
      "order": 5,
      "type": "BATTLE",
      "gold_eligible": true,
      "base_coin": 5,
      "target_score": 775,
      "score_rule_type": "通关分数",
      "play_limit": 4,
      "discard_limit": 3,
      "difficulty": "UNSPECIFIED",
      "ai_index": 0,
      "persona_generate_count": 0,
      "implementation_status": "CONFIG_READY_NOT_WIRED",
      "source": {
        "file": "人格牌.xlsx",
        "sheet": "关卡流程",
        "row": 6,
        "raw": {
          "type": "战斗",
          "reward_type": "金币",
          "reward_value": 5
        }
      }
    },
    {
      "id": "STAGE_06",
      "name": "关卡5",
      "order": 6,
      "type": "BATTLE",
      "gold_eligible": true,
      "base_coin": 5,
      "target_score": 875,
      "score_rule_type": "通关分数",
      "play_limit": 4,
      "discard_limit": 3,
      "difficulty": "UNSPECIFIED",
      "ai_index": 0,
      "persona_generate_count": 0,
      "implementation_status": "CONFIG_READY_NOT_WIRED",
      "source": {
        "file": "人格牌.xlsx",
        "sheet": "关卡流程",
        "row": 7,
        "raw": {
          "type": "战斗",
          "reward_type": "金币",
          "reward_value": 5
        }
      }
    },
    {
      "id": "STAGE_07",
      "name": "关卡6",
      "order": 7,
      "type": "BATTLE",
      "gold_eligible": true,
      "base_coin": 8,
      "target_score": 975,
      "score_rule_type": "通关分数",
      "play_limit": 4,
      "discard_limit": 3,
      "difficulty": "UNSPECIFIED",
      "ai_index": 0,
      "persona_generate_count": 0,
      "implementation_status": "CONFIG_READY_NOT_WIRED",
      "source": {
        "file": "人格牌.xlsx",
        "sheet": "关卡流程",
        "row": 8,
        "raw": {
          "type": "战斗",
          "reward_type": "金币",
          "reward_value": 8
        }
      }
    },
    {
      "id": "STAGE_08",
      "name": "AI2",
      "order": 8,
      "type": "SHOP",
      "gold_eligible": false,
      "base_coin": 0,
      "target_score": 0,
      "score_rule_type": "无",
      "play_limit": 0,
      "discard_limit": 0,
      "difficulty": "N/A",
      "ai_index": 1,
      "persona_generate_count": 1,
      "implementation_status": "CONFIG_READY_NOT_WIRED",
      "source": {
        "file": "人格牌.xlsx",
        "sheet": "关卡流程",
        "row": 9,
        "raw": {
          "type": "商店",